{
  "formatVersion": 1,
  "version": "0.10.7-beta.1",
  "approvedFiles": [
    "assets/product-settings.css"
  ],
  "files": [
    {
      "path": "assets/product-settings.css",
      "action": "put",
      "sha256": "8945b39410a70ff7411e90486ddbf40bbd0a345bbf0e34fcee20e4a7103c5f33",
      "contentBase64": "LnNldHRpbmdzLWhlYWRpbmd7ZGlzcGxheTpmbGV4O2FsaWduLWl0ZW1zOmZsZXgtc3RhcnQ7anVzdGlmeS1jb250ZW50OnNwYWNlLWJldHdlZW47Z2FwOjIwcHg7bWFyZ2luLWJvdHRvbToxNnB4fS5zZXR0aW5ncy1oZWFkaW5nIGgye21hcmdpbjoycHggMCA0cHg7Zm9udC1zaXplOjMwcHh9LnNldHRpbmdzLWhlYWRpbmcgcHttYXJnaW46MH0uc2V0dGluZ3Mtc2VjdGlvbnN7ZGlzcGxheTpncmlkO2dyaWQtdGVtcGxhdGUtY29sdW1uczpyZXBlYXQoMixtaW5tYXgoMCwxZnIpKTtnYXA6MTZweDttYXJnaW4tYm90dG9tOjE2cHh9LnNldHRpbmdzLWNhcmR7ZGlzcGxheTpncmlkO2FsaWduLWNvbnRlbnQ6c3RhcnQ7Z2FwOjE0cHh9LnNldHRpbmdzLWNhcmQgaDJ7bWFyZ2luOjB9LnNldHRpbmdzLWdyaWR7ZGlzcGxheTpncmlkO2dyaWQtdGVtcGxhdGUtY29sdW1uczpyZXBlYXQoMixtaW5tYXgoMCwxZnIpKTtnYXA6MTJweH0uc2V0dGluZ3MtY2FyZCBsYWJlbHtkaXNwbGF5OmdyaWQ7Z2FwOjZweDtmb250LXdlaWdodDo3MDB9LnNldHRpbmdzLWNhcmQgc21hbGwsLnNldHRpbmdzLW5vdGV7Y29sb3I6dmFyKC0tbXV0ZWQpO2ZvbnQtd2VpZ2h0OjQwMH0uYWR2aXNvci1zZXR0aW5ncy1saXN0e2Rpc3BsYXk6Z3JpZDtnYXA6OXB4fS5hZHZpc29yLXNldHRpbmd7ZGlzcGxheTpncmlkO2dyaWQtdGVtcGxhdGUtY29sdW1uczptaW5tYXgoMTUwcHgsLjdmcikgbWlubWF4KDM0MHB4LDEuNWZyKSBhdXRvO2FsaWduLWl0ZW1zOmNlbnRlcjtnYXA6MTRweDtwYWRkaW5nOjEycHg7Ym9yZGVyOjFweCBzb2xpZCB2YXIoLS1ib3JkZXIpO2JvcmRlci1yYWRpdXM6MTJweDtiYWNrZ3JvdW5kOiNmOGZiZmR9LmFkdmlzb3Itc2V0dGluZz5kaXY6Zmlyc3QtY2hpbGR7ZGlzcGxheTpncmlkO2dhcDoycHh9LmFkdmlzb3Itc2V0dGluZz5kaXY6Zmlyc3QtY2hpbGQgc3Ryb25ne2ZvbnQtc2l6ZToxN3B4fS5hZHZpc29yLXNldHRpbmc+ZGl2OmZpcnN0LWNoaWxkIHNwYW57Y29sb3I6dmFyKC0tbXV0ZWQpO2ZvbnQtc2l6ZToxMnB4fS5hZHZpc29yLXNldHRpbmcuaW5hY3RpdmV7b3BhY2l0eTouN30uYWR2aXNvci1zZXR0aW5nLnJlbW92ZWR7YmFja2dyb3VuZDojZjJmNGY1fS5hZHZpc29yLXBhcnRpY2lwYXRpb257ZGlzcGxheTpncmlkO2dyaWQtdGVtcGxhdGUtY29sdW1uczpyZXBlYXQoMixtaW5tYXgoMCwxZnIpKTtnYXA6N3B4IDEycHh9LmFkdmlzb3ItcGFydGljaXBhdGlvbiBsYWJlbHtkaXNwbGF5OmZsZXg7YWxpZ24taXRlbXM6Y2VudGVyO2dhcDo3cHg7Zm9udC1zaXplOjEzcHh9LmFkdmlzb3ItcGFydGljaXBhdGlvbiBpbnB1dHt3aWR0aDoxOHB4O2hlaWdodDoxOHB4fS5hZHZpc29yLXNldHRpbmcgYnV0dG9ue3doaXRlLXNwYWNlOm5vd3JhcH0uc2V0dGluZ3Mtbm90ZXttYXJnaW46MH1AbWVkaWEobWF4LXdpZHRoOjk1MHB4KXsuc2V0dGluZ3Mtc2VjdGlvbnN7Z3JpZC10ZW1wbGF0ZS1jb2x1bW5zOjFmcn0uYWR2aXNvci1zZXR0aW5ne2dyaWQtdGVtcGxhdGUtY29sdW1uczoxZnJ9LnNldHRpbmdzLWdyaWR7Z3JpZC10ZW1wbGF0ZS1jb2x1bW5zOjFmcn19Ci5jb25maWd1cmF0aW9uLWxpc3R7ZGlzcGxheTpncmlkO2dhcDo4cHh9LmNvbmZpZ3VyYXRpb24tcm93e2Rpc3BsYXk6Z3JpZDtncmlkLXRlbXBsYXRlLWNvbHVtbnM6bWlubWF4KDE4MHB4LDFmcikgYXV0byBhdXRvO2FsaWduLWl0ZW1zOmNlbnRlcjtnYXA6MTBweDtwYWRkaW5nOjlweCAxMHB4O2JvcmRlcjoxcHggc29saWQgdmFyKC0tYm9yZGVyKTtib3JkZXItcmFkaXVzOjEwcHg7YmFja2dyb3VuZDojZjhmYmZkfS5jb25maWd1cmF0aW9uLXJvdz5pbnB1dHttaW4td2lkdGg6MH0uY29tcGFjdC10b2dnbGV7ZGlzcGxheTpmbGV4IWltcG9ydGFudDthbGlnbi1pdGVtczpjZW50ZXI7Z2FwOjZweCFpbXBvcnRhbnQ7Zm9udC1zaXplOjEzcHh9LmNvbXBhY3QtdG9nZ2xlIGlucHV0e3dpZHRoOjE4cHg7aGVpZ2h0OjE4cHh9Lm9yZGVyLWNvbnRyb2xze2Rpc3BsYXk6ZmxleDtnYXA6NnB4fS5vcmRlci1jb250cm9scyBidXR0b257bWluLXdpZHRoOjM4cHg7cGFkZGluZzo3cHggMTBweDtmb250LXNpemU6MTdweH0ud29ya3NoZWV0LW9yZGVyLXJvd3tncmlkLXRlbXBsYXRlLWNvbHVtbnM6MWZyIGF1dG99LndvcmtzaGVldC1vcmRlci1yb3cgc3Ryb25ne2ZvbnQtc2l6ZToxNXB4fUBtZWRpYShtYXgtd2lkdGg6OTUwcHgpey5jb25maWd1cmF0aW9uLXJvd3tncmlkLXRlbXBsYXRlLWNvbHVtbnM6MWZyIGF1dG99LmNvbmZpZ3VyYXRpb24tcm93PmlucHV0e2dyaWQtY29sdW1uOjEvLTF9fQouc2V0dXAtaGVhZGluZ3tkaXNwbGF5OmZsZXg7YWxpZ24taXRlbXM6ZmxleC1zdGFydDtqdXN0aWZ5LWNvbnRlbnQ6c3BhY2UtYmV0d2VlbjtnYXA6MThweDttYXJnaW4tYm90dG9tOjE2cHh9LnNldHVwLWhlYWRpbmcgaDJ7Zm9udC1zaXplOjMycHg7bWFyZ2luOjJweCAwIDVweH0uc2V0dXAtaGVhZGluZyBwe21hcmdpbjowO21heC13aWR0aDo3NjBweH0uc2V0dXAtY2hlY2tsaXN0e2Rpc3BsYXk6Z3JpZDtnYXA6MTBweH0uc2V0dXAtc3RlcHtkaXNwbGF5OmdyaWQ7Z3JpZC10ZW1wbGF0ZS1jb2x1bW5zOjQycHggbWlubWF4KDAsMWZyKSBhdXRvIGF1dG87YWxpZ24taXRlbXM6Y2VudGVyO2dhcDoxNHB4O3BhZGRpbmc6MTRweCAxNnB4O2JvcmRlcjoxcHggc29saWQgdmFyKC0tYm9yZGVyKTtib3JkZXItcmFkaXVzOjE0cHg7YmFja2dyb3VuZDojZmZmfS5zZXR1cC1zdGVwPmJ7ZGlzcGxheTpncmlkO3BsYWNlLWl0ZW1zOmNlbnRlcjt3aWR0aDozNnB4O2hlaWdodDozNnB4O2JvcmRlci1yYWRpdXM6NTAlO2JhY2tncm91bmQ6I2VhZjJmNjtjb2xvcjp2YXIoLS1hY2NlbnQpO2ZvbnQtc2l6ZToxN3B4fS5zZXR1cC1zdGVwIGgze21hcmdpbjowIDAgM3B4O2ZvbnQtc2l6ZToxOHB4fS5zZXR1cC1zdGVwIHB7bWFyZ2luOjA7Y29sb3I6dmFyKC0tbXV0ZWQpfS5zZXR1cC1zdGVwPnNwYW57Zm9udC1zaXplOjEycHg7Zm9udC13ZWlnaHQ6ODAwO2xldHRlci1zcGFjaW5nOi4wN2VtO2NvbG9yOnZhcigtLW11dGVkKX0uc2V0dXAtc3RlcC5jb21wbGV0ZXtib3JkZXItY29sb3I6I2E5ZDhjMztiYWNrZ3JvdW5kOiNmN2ZjZjl9LnNldHVwLXN0ZXAucmVxdWlyZWQsLnNldHVwLXN0ZXAuYWN0aW9uLW5lZWRlZHtib3JkZXItY29sb3I6I2UzYjg2NTtiYWNrZ3JvdW5kOiNmZmZhZjB9LnNldHVwLWFjdGlvbnN7ZGlzcGxheTpmbGV4O2FsaWduLWl0ZW1zOmNlbnRlcjtqdXN0aWZ5LWNvbnRlbnQ6c3BhY2UtYmV0d2VlbjtnYXA6MTZweDttYXJnaW4tdG9wOjE2cHg7cGFkZGluZzoxNnB4O2JvcmRlci1yYWRpdXM6MTRweDtiYWNrZ3JvdW5kOiNlZGY1Zjh9LnNldHVwLWFjdGlvbnMgcHttYXJnaW46MH0uc2V0dXAtc291cmNlLWxpc3R7ZGlzcGxheTpncmlkO2dyaWQtdGVtcGxhdGUtY29sdW1uczpyZXBlYXQoMixtaW5tYXgoMCwxZnIpKTtnYXA6OHB4O21hcmdpbi10b3A6MTJweH0uc2V0dXAtc291cmNlLWxpc3QgbGFiZWx7ZGlzcGxheTpncmlkO2dyaWQtdGVtcGxhdGUtY29sdW1uczptaW5tYXgoMCwxZnIpIGF1dG87Z2FwOjRweCAxMHB4O2FsaWduLWl0ZW1zOmNlbnRlcjtwYWRkaW5nOjlweDtib3JkZXI6MXB4IHNvbGlkIHZhcigtLWJvcmRlcik7Ym9yZGVyLXJhZGl1czoxMHB4O2JhY2tncm91bmQ6I2Y4ZmJmZH0uc2V0dXAtc291cmNlLWxpc3QgbGFiZWwgc3BhbntkaXNwbGF5OmdyaWR9LnNldHVwLXNvdXJjZS1saXN0IHNtYWxse2NvbG9yOnZhcigtLW11dGVkKTtmb250LXdlaWdodDo0MDB9LnNldHVwLXNvdXJjZS1saXN0IHNlbGVjdHtncmlkLXJvdzoxLzM7Z3JpZC1jb2x1bW46Mn0uc2V0dXAtc291cmNlLWxpc3QgZW17Zm9udC1zaXplOjEwcHg7Zm9udC1zdHlsZTpub3JtYWw7Zm9udC13ZWlnaHQ6ODAwO2NvbG9yOnZhcigtLW11dGVkKX0uc2V0dXAtc2V0dGluZ3Mtc3VtbWFyeXtncmlkLWNvbHVtbjoxLy0xO2Rpc3BsYXk6ZmxleDthbGlnbi1pdGVtczpjZW50ZXI7anVzdGlmeS1jb250ZW50OnNwYWNlLWJldHdlZW59LnNldHVwLXNldHRpbmdzLXN1bW1hcnkgaDJ7bWFyZ2luOjJweCAwfS5zZXR1cC1hdHRlbnRpb257b3V0bGluZToycHggc29saWQgI2Q5OWIyOX0uc2V0dXAtcmVxdWlyZWQtYmFubmVye2Rpc3BsYXk6ZmxleDthbGlnbi1pdGVtczpjZW50ZXI7Z2FwOjEycHg7cGFkZGluZzoxMXB4IDE0cHg7bWFyZ2luLWJvdHRvbToxNHB4O2JvcmRlcjoxcHggc29saWQgI2UzYjg2NTtib3JkZXItcmFkaXVzOjEycHg7YmFja2dyb3VuZDojZmZmOGU3O2NvbG9yOiM2MjQ0MGR9LnNldHVwLXJlcXVpcmVkLWJhbm5lciBzdHJvbmd7d2hpdGUtc3BhY2U6bm93cmFwfS5zZXR1cC1yZXF1aXJlZC1iYW5uZXJbaGlkZGVuXXtkaXNwbGF5Om5vbmV9QG1lZGlhKG1heC13aWR0aDo4NTBweCl7LnNldHVwLXN0ZXB7Z3JpZC10ZW1wbGF0ZS1jb2x1bW5zOjQycHggMWZyfS5zZXR1cC1zdGVwPnNwYW4sLnNldHVwLXN0ZXA+YnV0dG9ue2dyaWQtY29sdW1uOjJ9LnNldHVwLXNvdXJjZS1saXN0e2dyaWQtdGVtcGxhdGUtY29sdW1uczoxZnJ9LnNldHVwLXNldHRpbmdzLXN1bW1hcnksLnNldHVwLWFjdGlvbnN7YWxpZ24taXRlbXM6ZmxleC1zdGFydDtmbGV4LWRpcmVjdGlvbjpjb2x1bW59fQoucmVjb3ZlcnktY2FyZHtkaXNwbGF5OmdyaWQ7YWxpZ24tY29udGVudDpzdGFydDtnYXA6MTZweH0ucmVjb3ZlcnktY2FyZCAuc2VjdGlvbi1oZWFke2Rpc3BsYXk6ZmxleDthbGlnbi1pdGVtczpmbGV4LXN0YXJ0O2p1c3RpZnktY29udGVudDpzcGFjZS1iZXR3ZWVuO2dhcDoxNnB4fS5yZWNvdmVyeS1jYXJkIGgye21hcmdpbjoycHggMCA0cHh9LnJlY292ZXJ5LWNhcmQgcHttYXJnaW46MH0ucmVjb3Zlcnktc3VtbWFyeSwuZGlhZ25vc3RpYy1idWlsZHtkaXNwbGF5OmdyaWQ7Z3JpZC10ZW1wbGF0ZS1jb2x1bW5zOnJlcGVhdCgyLG1pbm1heCgwLDFmcikpO2dhcDoxMHB4fS5yZWNvdmVyeS1zdW1tYXJ5PmRpdiwuZGlhZ25vc3RpYy1idWlsZD5kaXZ7ZGlzcGxheTpncmlkO2dhcDo0cHg7cGFkZGluZzoxMnB4O2JvcmRlcjoxcHggc29saWQgdmFyKC0tYm9yZGVyKTtib3JkZXItcmFkaXVzOjExcHg7YmFja2dyb3VuZDojZjhmYmZkfS5yZWNvdmVyeS1zdW1tYXJ5IHNwYW4sLmRpYWdub3N0aWMtYnVpbGQgc3Bhbntjb2xvcjp2YXIoLS1tdXRlZCk7Zm9udC1zaXplOjExcHg7Zm9udC13ZWlnaHQ6ODAwO2xldHRlci1zcGFjaW5nOi4wNmVtfS5yZWNvdmVyeS1zdW1tYXJ5IHN0cm9uZywuZGlhZ25vc3RpYy1idWlsZCBzdHJvbmd7Zm9udC1zaXplOjE2cHh9LmRpYWdub3N0aWMtYnVpbGQgc21hbGx7Y29sb3I6dmFyKC0tbXV0ZWQpfS5yZWNvdmVyeS1hY3Rpb25ze2Rpc3BsYXk6ZmxleDtmbGV4LXdyYXA6d3JhcDtnYXA6OXB4fS5yZWNvdmVyeS1jYXJkPmxhYmVse2Rpc3BsYXk6Z3JpZDtnYXA6NnB4O2ZvbnQtd2VpZ2h0OjcwMH0ucmVjb3ZlcnktZGV0YWlse3BhZGRpbmc6MTBweCAxMnB4O2JvcmRlci1yYWRpdXM6MTBweDtiYWNrZ3JvdW5kOiNmM2Y3Zjk7Y29sb3I6dmFyKC0tbXV0ZWQpfS5yZWNvdmVyeS1jYXJkIC5kYW5nZXJ7anVzdGlmeS1zZWxmOnN0YXJ0O2JvcmRlci1jb2xvcjojYjg0YjRiO2NvbG9yOiM4YjI0MjR9LmRpYWdub3N0aWNzLW92ZXJ2aWV3e2Rpc3BsYXk6Z3JpZDtnYXA6MTJweH0uZGlhZ25vc3RpY3Mtb3ZlcnZpZXcgaDN7bWFyZ2luOjJweCAwIDB9LmRpYWdub3N0aWNzLW92ZXJ2aWV3IHVse2Rpc3BsYXk6Z3JpZDtnYXA6NXB4O21hcmdpbjowO3BhZGRpbmc6MDtsaXN0LXN0eWxlOm5vbmV9LmRpYWdub3N0aWNzLW92ZXJ2aWV3IGxpe2Rpc3BsYXk6Z3JpZDtncmlkLXRlbXBsYXRlLWNvbHVtbnM6bWlubWF4KDE0MHB4LC44ZnIpIG1pbm1heCgxNDBweCwxZnIpIG1pbm1heCgxNjBweCwxZnIpO2dhcDoxMHB4O3BhZGRpbmc6N3B4IDlweDtib3JkZXItYm90dG9tOjFweCBzb2xpZCB2YXIoLS1ib3JkZXIpfS5kaWFnbm9zdGljcy1vdmVydmlldyBsaSBzcGFuLC5kaWFnbm9zdGljcy1vdmVydmlldyBsaSBzbWFsbHtjb2xvcjp2YXIoLS1tdXRlZCl9I2RpYWdub3N0aWNzTG9jYXRpb257ZGlzcGxheTpibG9jaztwYWRkaW5nOjEwcHg7Ym9yZGVyLXJhZGl1czo4cHg7YmFja2dyb3VuZDojZWVmM2Y1O292ZXJmbG93LXdyYXA6YW55d2hlcmV9I2RpYWdub3N0aWNzTG9jYXRpb25baGlkZGVuXXtkaXNwbGF5Om5vbmV9QG1lZGlhKG1heC13aWR0aDo3MDBweCl7LnJlY292ZXJ5LXN1bW1hcnksLmRpYWdub3N0aWMtYnVpbGR7Z3JpZC10ZW1wbGF0ZS1jb2x1bW5zOjFmcn0uZGlhZ25vc3RpY3Mtb3ZlcnZpZXcgbGl7Z3JpZC10ZW1wbGF0ZS1jb2x1bW5zOjFmcjtnYXA6MnB4fX0KLmRlc3RydWN0aXZlLWNhcmR7Z3JpZC1jb2x1bW46MS8tMTtkaXNwbGF5OmdyaWQ7Z2FwOjE0cHg7Ym9yZGVyOjJweCBzb2xpZCAjYjg0YjRiO2JhY2tncm91bmQ6I2ZmZjlmOH0uZGVzdHJ1Y3RpdmUtY2FyZCBoMnttYXJnaW46MDtjb2xvcjojODYyNDI0fS5kZXN0cnVjdGl2ZS1jYXJkIHB7bWFyZ2luOjA7bWF4LXdpZHRoOjkwMHB4fS50YXJnZXQtaWRlbnRpdHl7ZGlzcGxheTpncmlkO2dhcDo0cHg7cGFkZGluZzoxMnB4IDE0cHg7Ym9yZGVyLXJhZGl1czoxMHB4O2JhY2tncm91bmQ6I2Y3ZTllN30udGFyZ2V0LWlkZW50aXR5IHNwYW57Zm9udC1zaXplOjExcHg7Zm9udC13ZWlnaHQ6ODAwO2xldHRlci1zcGFjaW5nOi4wOGVtO2NvbG9yOiM4NjI0MjR9LnRhcmdldC1pZGVudGl0eSBzdHJvbmd7Zm9udC1zaXplOjE4cHh9LmRlc3RydWN0aXZlLWNhcmQgZGV0YWlsc3twYWRkaW5nOjEwcHggMTJweDtib3JkZXI6MXB4IHNvbGlkICNkZGIwYWE7Ym9yZGVyLXJhZGl1czoxMHB4O2JhY2tncm91bmQ6I2ZmZn0uZGVzdHJ1Y3RpdmUtY2FyZCBzdW1tYXJ5e2N1cnNvcjpwb2ludGVyO2ZvbnQtd2VpZ2h0OjgwMH0uZGVzdHJ1Y3RpdmUtY2FyZCB1bHtjb2x1bW5zOjI7bWFyZ2luLWJvdHRvbTowfS5kZXN0cnVjdGl2ZS1jaGVja3tkaXNwbGF5OmZsZXghaW1wb3J0YW50O2dyaWQtdGVtcGxhdGUtY29sdW1uczpub25lIWltcG9ydGFudDthbGlnbi1pdGVtczpmbGV4LXN0YXJ0O2dhcDo5cHghaW1wb3J0YW50O2ZvbnQtd2VpZ2h0OjcwMH0uZGVzdHJ1Y3RpdmUtY2hlY2sgaW5wdXR7d2lkdGg6MTlweDtoZWlnaHQ6MTlweDttYXJnaW4tdG9wOjFweH0uZGVzdHJ1Y3RpdmUtY2FyZD5sYWJlbDpub3QoLmRlc3RydWN0aXZlLWNoZWNrKXtkaXNwbGF5OmdyaWQ7Z2FwOjZweDttYXgtd2lkdGg6NTIwcHh9LmRlc3RydWN0aXZlLWNhcmQgLmRhbmdlcntqdXN0aWZ5LXNlbGY6c3RhcnQ7cGFkZGluZzoxMXB4IDE